<?xml version="1.0" encoding="utf-8" ?>
<products xmlns:xsi="http://www.w3.org/2001/XMLSchema-instance"
	xsi:noNamespaceSchemaLocation='productsSchema.xsd'>	
	<product code="123-00">
		<category>CategoryA</category>
		<name>Product A</name>
		<description>Description A</description>
		<quantity>abc</quantity>
		<unitprice>10.50</unitprice>
	</product>
	<product code="123-01">
		<category>CategoryA</category>
		<name>Product B</name>
		<description>Description B</description>
		<quantity>5</quantity>
		<unitprice>5.0</unitprice>
	</product>
	<product code="123-02">
		<category>CategoryB</category>
		<name>Product C</name>
		<description>Description C</description>
		<quantity>100</quantity>
		<unitprice>7</unitprice>
	</product>
	<product code="123-03">
		<category>CategoryC</category>
		<name>Product D</name>
		<description>Description D</description>
		<quantity>abc</quantity>
		<unitprice>10.50</unitprice>
	</product>
	<product code="123-04">
		<category>CategoryA</category>
		<name>Product E</name>
		<description>Description E</description>
		<quantity>5</quantity>
		<unitprice>5.0</unitprice>
	</product>
	<product code="123-05">
		<category>CategoryB</category>
		<name>Product F</name>
		<description>Description F</description>
		<quantity>100</quantity>
		<unitprice>7</unitprice>
	</product>
	<product code="123-06">
		<category>CategoryC</category>
		<name>Product D</name>
		<description>Description D</description>
		<quantity>50</quantity>
		<unitprice>10.50</unitprice>
	</product>
	<product code="123-07">
		<category>CategoryA</category>
		<name>Product E</name>
		<description>Description E</description>
		<quantity>5</quantity>
		<unitprice>5.0</unitprice>
	</product>
	<product code="123-08">
		<category>CategoryB</category>
		<name>Product F</name>
		<description>Description F</description>
		<quantity>-1</quantity>
		<unitprice>7</unitprice>
	</product>
	<product code="123-09">
		<category>CategoryB</category>
		<name>Product F</name>
		<description>Description F</description>
		<quantity>100</quantity>
		<unitprice>7</unitprice>
	</product>
</products>